{
  "spec": "alms.dev/runtime-audit-finding-ledger/v0",
  "generated_offline": true,
  "disclaimer": "Consolidated Phase 0 finding ledger (P0.7C). Derived from offline evidence, P0.6C human acceptance, P0.6D model-identity closure, P0.7A L-01, and P0.7B PydanticAI stress lane. NOT live provider semantic evidence. Proposed findings remain proposed until explicit KJ acceptance.",
  "findings": [
    {
      "spec": "alms.dev/runtime-audit-finding/v0",
      "id": "N-01",
      "severity": "F1",
      "status": "accepted",
      "runtime_lanes": ["openai-native", "langchain", "anthropic-native", "gemini-native"],
      "fixture_ids": ["USAGE-001"],
      "assumption_id": "usage-provenance-reported",
      "expected_behavior": "Framework-normalized usage must be distinguishable from provider-reported usage in the shared result contract.",
      "observed_behavior": "results._usage_block hardcoded provenance=reported for all present usage, so LangChain framework-normalized usage_metadata was indistinguishable from provider-reported usage.",
      "reproduction_command": "cd research/runtime-audit/harness && uv run pytest tests/test_usage_provenance.py -q",
      "raw_evidence_refs": ["reports/protocol-neutrality-matrix.json#findings/N-01"],
      "normalized_evidence_refs": ["harness/tests/test_usage_provenance.py"],
      "semantic_impact": "False equivalence between framework and provider usage provenance in cross-lane comparison.",
      "contract_implication": "Additive usage.source field and provenance vocabulary; LangChain usage tagged framework_native.",
      "confidence": "high",
      "follow_up_experiment": "Live lane comparison: confirm provider-reported vs framework-normalized usage source tags under real responses.",
      "kj_decision": "Accepted F1 (2026-07-13, KJ): contract-level false equivalence."
    },
    {
      "spec": "alms.dev/runtime-audit-finding/v0",
      "id": "N-02",
      "severity": "F1",
      "status": "accepted",
      "runtime_lanes": ["openai-native", "langchain", "anthropic-native", "gemini-native"],
      "fixture_ids": ["USAGE-001"],
      "assumption_id": "usage-openai-nested-paths",
      "expected_behavior": "Non-OpenAI cache and reasoning token fields must survive into the shared result summary without OpenAI-shaped coupling.",
      "observed_behavior": "results._usage_block read only OpenAI-nested cache/reasoning paths; Anthropic cache_creation/cache_read and LangChain input_token_details tokens were dropped to null in the result summary.",
      "reproduction_command": "cd research/runtime-audit/harness && uv run pytest tests/test_usage_provenance.py -q",
      "raw_evidence_refs": ["reports/protocol-neutrality-matrix.json#findings/N-02"],
      "normalized_evidence_refs": ["harness/tests/test_usage_provenance.py", "harness/src/alms_audit/normalizers/anthropic.py"],
      "semantic_impact": "Result-level data loss for supported non-OpenAI usage fields; OpenAI vendor-shape coupling in shared contract.",
      "contract_implication": "Neutral usage extraction per lane; cache_creation_input_tokens and cache_read_input_tokens added to result.usage.",
      "confidence": "high",
      "follow_up_experiment": "Live Anthropic and LangChain USAGE-001 runs to confirm cache split preservation.",
      "kj_decision": "Accepted F1 (2026-07-13, KJ): contract-level provider-shape coupling and result-level data loss."
    },
    {
      "spec": "alms.dev/runtime-audit-finding/v0",
      "id": "N-03",
      "severity": "F2",
      "status": "accepted",
      "runtime_lanes": ["openai-native", "langchain", "anthropic-native", "gemini-native"],
      "fixture_ids": ["GEN-001", "STREAM-001", "TOOL-001"],
      "assumption_id": "terminal-state-queryable",
      "expected_behavior": "Native provider/framework terminal states must be queryable at the result level without collapsing transcript detail.",
      "observed_behavior": "Native terminal states (requires_action, incomplete, refusal, stop_reason, finish_reason) were preserved only in the transcript and collapsed to PASS/PASS_WITH_EXTENSION at the result level.",
      "reproduction_command": "cd research/runtime-audit/harness && uv run pytest tests/test_terminal_state.py -q",
      "raw_evidence_refs": ["reports/protocol-neutrality-matrix.json#findings/N-03"],
      "normalized_evidence_refs": ["harness/tests/test_terminal_state.py", "spec/result.schema.json"],
      "semantic_impact": "Capability-shaping: Phase 1A needs queryable native terminal vocabulary at result level.",
      "contract_implication": "Additive result.observed_terminal_state {native, category, source}.",
      "confidence": "high",
      "follow_up_experiment": "Live Gemini TOOL-001 requires_action and Anthropic refusal terminal states.",
      "kj_decision": "Accepted F2 (2026-07-13, KJ): carry to Phase 1A."
    },
    {
      "spec": "alms.dev/runtime-audit-finding/v0",
      "id": "N-04",
      "severity": "F2",
      "status": "accepted",
      "runtime_lanes": ["openai-native", "langchain", "anthropic-native", "gemini-native", "litellm-sdk", "pydantic-ai-agent"],
      "fixture_ids": ["GEN-001"],
      "assumption_id": "provenance-vocabulary",
      "expected_behavior": "Provider-vs-framework and reported-vs-estimated distinctions must use a centrally-owned provenance vocabulary.",
      "observed_behavior": "No central provenance vocabulary existed; distinctions were expressed only by scattered signals.",
      "reproduction_command": "cd research/runtime-audit/harness && uv run pytest tests/test_protocol_neutrality.py::test_shipped_neutrality_matrix_validates_against_its_schema -q",
      "raw_evidence_refs": ["reports/protocol-neutrality-matrix.json#provenance_vocabulary", "harness/src/alms_audit/provenance.py"],
      "normalized_evidence_refs": ["harness/tests/test_usage_provenance.py"],
      "semantic_impact": "Capability-shaping: cross-lane comparison and result records need consistent provenance tags.",
      "contract_implication": "Central provenance vocabulary (nine terms) in provenance.py and protocol-neutrality matrix.",
      "confidence": "high",
      "follow_up_experiment": null,
      "kj_decision": "Accepted F2 (2026-07-13, KJ): carry to Phase 1A."
    },
    {
      "spec": "alms.dev/runtime-audit-finding/v0",
      "id": "N-05",
      "severity": "F3",
      "status": "accepted",
      "runtime_lanes": ["openai-native", "langchain", "anthropic-native", "gemini-native", "litellm-sdk", "pydantic-ai-agent"],
      "fixture_ids": ["GEN-001"],
      "assumption_id": "model-identity-provenance",
      "expected_behavior": "Requested model and provider-returned model must be separate first-class fields with auditable provenance.",
      "observed_behavior": "probe-response.model held requested model only; served model was preserved only in raw until P0.6D added observed_model_identity on results.",
      "reproduction_command": "cd research/runtime-audit/harness && uv run pytest tests/test_model_identity.py -q",
      "raw_evidence_refs": ["docs/P0.6D_MODEL_IDENTITY_PROVENANCE.md"],
      "normalized_evidence_refs": ["harness/tests/test_model_identity.py", "spec/result.schema.json"],
      "semantic_impact": "Implementation note closed offline; real alias/routing/snapshot behavior remains unverified_until_live.",
      "contract_implication": "Additive result.observed_model_identity with requested_model, observed_returned_model, source, raw_ref, model_identity_match.",
      "confidence": "high",
      "follow_up_experiment": "Live runs comparing requested vs returned model across native and framework lanes.",
      "kj_decision": "Accepted F3 (2026-07-13, KJ); closed offline in P0.6D."
    },
    {
      "spec": "alms.dev/runtime-audit-finding/v0",
      "id": "L-01",
      "severity": "F2",
      "status": "proposed",
      "runtime_lanes": ["litellm-sdk"],
      "fixture_ids": ["TOOL-001"],
      "assumption_id": "litellm-sdk-tool-path",
      "expected_behavior": "SDK-only lane should exercise the complete litellm.completion(tools=...) path without proxy-server dependencies.",
      "observed_behavior": "litellm.completion(tools=...) imports proxy MCP utilities requiring FastAPI, absent by design in the SDK-only isolated probe. TOOL-001 uses partial path: get_optional_params request transform + ModelResponse injection.",
      "reproduction_command": "cd research/runtime-audit/probes/litellm-sdk && uv run pytest tests/ -q -k tool",
      "raw_evidence_refs": ["reports/protocol-neutrality-matrix.json#findings/L-01", "reports/protocol-neutrality-matrix.json#fixture_coverage/litellm-sdk/execution_paths/TOOL-001"],
      "normalized_evidence_refs": ["harness/tests/test_lane_dispatch.py::test_full_offline_litellm_simulation_all_six"],
      "semantic_impact": "Capability-shaping: SDK-only tool semantics partially offline; no shared contract loss or false provenance observed.",
      "contract_implication": "No contract change required; live completion(tools=...) path and provider adapter translation remain unverified_until_live.",
      "confidence": "high",
      "follow_up_experiment": "Live LiteLLM SDK TOOL-001 with direct provider credential (not Proxy Server); or accept partial offline path with documented limitation.",
      "kj_decision": null
    }
  ],
  "observations": [
    {
      "id": "PA-OBS-01",
      "lane": "pydantic-ai-agent",
      "title": "FunctionModel primary offline seam",
      "summary": "Offline evidence uses FunctionModel exclusively; TestModel excluded because it auto-synthesizes schema-valid output and hides framework behavior.",
      "evidence_source": "docs/P0.7B_PYDANTICAI_AGENT_STRESS_LANE.md; probes/pydantic-ai-agent/probe.manifest.json",
      "blocking": false,
      "owner": "audit-lab",
      "next_action": "None offline; live provider model would use vendor SDK not present in slim install."
    },
    {
      "id": "PA-OBS-02",
      "lane": "pydantic-ai-agent",